{
  "experiment_id": "tau3-v0-protocol-fix",
  "domain": "tau3",
  "date": "2026-09-19",
  "hypothesis": "The learner was ending episodes by writing a plain assistant message, which OpenHands treats as task completion, so tau2 never received a stop signal and every attempt scored zero. Making the MCP protocol explicit in the skill (speak only via send_message_to_user, close with end_conversation, never end a turn without a tool call) should produce completed conversations and a positive skill-minus-placebo delta.",
  "skill_version": "tau3-v0 (protocol-hardened)",
  "task_set": "tau3_dev_v1 first 3 (tasks 008, 026, 062)",
  "arms": ["placebo", "skill"],
  "concurrency": 4,
  "run_dir": "runs/tau3-v0-dev-4",
  "notes": "Prior run runs/tau3-v0-dev-3 with the same three tasks scored placebo 0.0 / skill 0.0; all six trials died after 1-3 steps with termination_reason=None and the verifier note 'Runtime ended without a valid tau2 stop signal'. After the skill change, skill trials ran 30-57 tool calls versus 1-6 for placebo, and task-008 passed. placebo 0.0, skill 0.3333, net_delta +0.3333 on n=3 - directionally encouraging but not statistically valid. Local eval_budget_tokens for tau3 was raised from 4M to 16M beforehand because an earlier 8-task run aborted at the 4M pool with a gateway 402; this is a local metering pool only and does not affect scored runs. research/parsing/parse_run.py was also fixed: it treated HealthBench-only reward.json/verdicts.json as required, so every tau3 attempt was misclassified as parser_failure and excluded from console comparisons."
}
